{
  "schema_version": 1,
  "group": { "id": "E", "name": "数字人节奏与过度出现", "source_kind": "seed" },
  "defaults": {
    "expected": { "scene_boundaries_us": null, "scene_tolerance_us": 250000, "stack_label": null, "important_event": false, "recommend_or_retain": true, "unique_event": false, "narrative_critical": false },
    "timeline": { "vfr_checkpoints_us": [], "proxy_checkpoints_us": [] },
    "routine": null
  },
  "fixtures": [
    { "id": "E-001", "source": { "kind": "seed", "relative_path": "E/E-001.mov", "generation_command": null }, "scenario": "数字人片头第一个版本", "golden": false, "expected": { "scene_boundaries_us": null, "scene_tolerance_us": 250000, "stack_label": "E-dh-intro", "important_event": false, "recommend_or_retain": true, "unique_event": false, "narrative_critical": false } },
    { "id": "E-002", "source": { "kind": "seed", "relative_path": "E/E-002.mov", "generation_command": null }, "scenario": "数字人片头第二个版本", "golden": false, "expected": { "scene_boundaries_us": null, "scene_tolerance_us": 250000, "stack_label": "E-dh-intro", "important_event": false, "recommend_or_retain": true, "unique_event": false, "narrative_critical": false } },
    { "id": "E-003", "source": { "kind": "seed", "relative_path": "E/E-003.mov", "generation_command": null }, "scenario": "数字人片头短版", "golden": false, "expected": { "scene_boundaries_us": null, "scene_tolerance_us": 250000, "stack_label": "E-dh-intro", "important_event": false, "recommend_or_retain": true, "unique_event": false, "narrative_critical": false } },
    { "id": "E-004", "source": { "kind": "seed", "relative_path": "E/E-004.mov", "generation_command": null }, "scenario": "数字人片头长版", "golden": false, "expected": { "scene_boundaries_us": null, "scene_tolerance_us": 250000, "stack_label": "E-dh-intro", "important_event": false, "recommend_or_retain": true, "unique_event": false, "narrative_critical": false } },
    { "id": "E-005", "source": { "kind": "seed", "relative_path": "E/E-005.mov", "generation_command": null }, "scenario": "数字人路线桥段一", "golden": false, "expected": { "scene_boundaries_us": null, "scene_tolerance_us": 250000, "stack_label": "E-dh-bridge", "important_event": false, "recommend_or_retain": true, "unique_event": false, "narrative_critical": false } },
    { "id": "E-006", "source": { "kind": "seed", "relative_path": "E/E-006.mov", "generation_command": null }, "scenario": "数字人路线桥段二", "golden": false, "expected": { "scene_boundaries_us": null, "scene_tolerance_us": 250000, "stack_label": "E-dh-bridge", "important_event": false, "recommend_or_retain": true, "unique_event": false, "narrative_critical": false } },
    { "id": "E-007", "source": { "kind": "seed", "relative_path": "E/E-007.mov", "generation_command": null }, "scenario": "数字人历史桥段", "golden": false, "expected": { "scene_boundaries_us": null, "scene_tolerance_us": 250000, "stack_label": "E-dh-bridge", "important_event": false, "recommend_or_retain": true, "unique_event": false, "narrative_critical": false } },
    { "id": "E-008", "source": { "kind": "seed", "relative_path": "E/E-008.mov", "generation_command": null }, "scenario": "数字人天气桥段", "golden": false, "expected": { "scene_boundaries_us": null, "scene_tolerance_us": 250000, "stack_label": "E-dh-bridge", "important_event": false, "recommend_or_retain": true, "unique_event": false, "narrative_critical": false } },
    { "id": "E-009", "source": { "kind": "seed", "relative_path": "E/E-009.mov", "generation_command": null }, "scenario": "数字人连续出现第一个槽位", "golden": false, "expected": { "scene_boundaries_us": null, "scene_tolerance_us": 250000, "stack_label": "E-dh-overuse", "important_event": false, "recommend_or_retain": true, "unique_event": false, "narrative_critical": false } },
    { "id": "E-010", "source": { "kind": "seed", "relative_path": "E/E-010.mov", "generation_command": null }, "scenario": "数字人连续出现第二个槽位", "golden": false, "expected": { "scene_boundaries_us": null, "scene_tolerance_us": 250000, "stack_label": "E-dh-overuse", "important_event": false, "recommend_or_retain": true, "unique_event": false, "narrative_critical": false } },
    { "id": "E-011", "source": { "kind": "seed", "relative_path": "E/E-011.mov", "generation_command": null }, "scenario": "数字人连续出现第三个槽位", "golden": false, "expected": { "scene_boundaries_us": null, "scene_tolerance_us": 250000, "stack_label": "E-dh-overuse", "important_event": false, "recommend_or_retain": true, "unique_event": false, "narrative_critical": false } },
    { "id": "E-012", "source": { "kind": "seed", "relative_path": "E/E-012.mov", "generation_command": null }, "scenario": "数字人连续出现第四个槽位", "golden": false, "expected": { "scene_boundaries_us": null, "scene_tolerance_us": 250000, "stack_label": "E-dh-overuse", "important_event": false, "recommend_or_retain": true, "unique_event": false, "narrative_critical": false } },
    { "id": "E-013", "source": { "kind": "seed", "relative_path": "E/E-013.mov", "generation_command": null }, "scenario": "数字人片尾第一版", "golden": false, "expected": { "scene_boundaries_us": null, "scene_tolerance_us": 250000, "stack_label": "E-dh-outro", "important_event": false, "recommend_or_retain": true, "unique_event": false, "narrative_critical": false } },
    { "id": "E-014", "source": { "kind": "seed", "relative_path": "E/E-014.mov", "generation_command": null }, "scenario": "数字人片尾第二版", "golden": false, "expected": { "scene_boundaries_us": null, "scene_tolerance_us": 250000, "stack_label": "E-dh-outro", "important_event": false, "recommend_or_retain": true, "unique_event": false, "narrative_critical": false } },
    { "id": "E-015", "source": { "kind": "seed", "relative_path": "E/E-015.mov", "generation_command": null }, "scenario": "数字人提供唯一安全说明", "golden": true, "expected": { "scene_boundaries_us": null, "scene_tolerance_us": 250000, "stack_label": "E-dh-critical", "important_event": true, "recommend_or_retain": true, "unique_event": true, "narrative_critical": true } },
    { "id": "E-016", "source": { "kind": "seed", "relative_path": "E/E-016.mov", "generation_command": null }, "scenario": "数字人片尾极短版", "golden": false, "expected": { "scene_boundaries_us": null, "scene_tolerance_us": 250000, "stack_label": "E-dh-outro", "important_event": false, "recommend_or_retain": true, "unique_event": false, "narrative_critical": false } }
  ]
}

