{
  "schema_version": 1,
  "group": { "id": "D", "name": "真人口播、对话与反应", "source_kind": "seed" },
  "defaults": {
    "expected": { "scene_boundaries_us": null, "scene_tolerance_us": 250000, "stack_label": null, "important_event": false, "recommend_or_retain": true, "unique_event": false, "narrative_critical": false },
    "timeline": { "vfr_checkpoints_us": [], "proxy_checkpoints_us": [] },
    "routine": null
  },
  "fixtures": [
    { "id": "D-001", "source": { "kind": "seed", "relative_path": "D/D-001.mov", "generation_command": null }, "scenario": "正面对镜口播完整 take", "golden": false, "expected": { "scene_boundaries_us": null, "scene_tolerance_us": 250000, "stack_label": "D-talking-head", "important_event": false, "recommend_or_retain": true, "unique_event": false, "narrative_critical": false } },
    { "id": "D-002", "source": { "kind": "seed", "relative_path": "D/D-002.mov", "generation_command": null }, "scenario": "口播第二 take", "golden": false, "expected": { "scene_boundaries_us": null, "scene_tolerance_us": 250000, "stack_label": "D-talking-head", "important_event": false, "recommend_or_retain": true, "unique_event": false, "narrative_critical": false } },
    { "id": "D-003", "source": { "kind": "seed", "relative_path": "D/D-003.mov", "generation_command": null }, "scenario": "边走边说", "golden": false, "expected": { "scene_boundaries_us": null, "scene_tolerance_us": 250000, "stack_label": "D-talking-head", "important_event": false, "recommend_or_retain": true, "unique_event": false, "narrative_critical": false } },
    { "id": "D-004", "source": { "kind": "seed", "relative_path": "D/D-004.mov", "generation_command": null }, "scenario": "车内口播", "golden": false, "expected": { "scene_boundaries_us": null, "scene_tolerance_us": 250000, "stack_label": "D-talking-head", "important_event": false, "recommend_or_retain": true, "unique_event": false, "narrative_critical": false } },
    { "id": "D-005", "source": { "kind": "seed", "relative_path": "D/D-005.mov", "generation_command": null }, "scenario": "双人对话主机位", "golden": false, "expected": { "scene_boundaries_us": null, "scene_tolerance_us": 250000, "stack_label": "D-dialogue", "important_event": false, "recommend_or_retain": true, "unique_event": false, "narrative_critical": false } },
    { "id": "D-006", "source": { "kind": "seed", "relative_path": "D/D-006.mov", "generation_command": null }, "scenario": "双人对话反打", "golden": false, "expected": { "scene_boundaries_us": null, "scene_tolerance_us": 250000, "stack_label": "D-dialogue", "important_event": false, "recommend_or_retain": true, "unique_event": false, "narrative_critical": false } },
    { "id": "D-007", "source": { "kind": "seed", "relative_path": "D/D-007.mov", "generation_command": null }, "scenario": "多人交叉对话", "golden": false, "expected": { "scene_boundaries_us": null, "scene_tolerance_us": 250000, "stack_label": "D-dialogue", "important_event": false, "recommend_or_retain": true, "unique_event": false, "narrative_critical": false } },
    { "id": "D-008", "source": { "kind": "seed", "relative_path": "D/D-008.mov", "generation_command": null }, "scenario": "对话中的长停顿", "golden": false, "expected": { "scene_boundaries_us": null, "scene_tolerance_us": 250000, "stack_label": "D-dialogue", "important_event": false, "recommend_or_retain": true, "unique_event": false, "narrative_critical": false } },
    { "id": "D-009", "source": { "kind": "seed", "relative_path": "D/D-009.mov", "generation_command": null }, "scenario": "口播被突发事件打断后的第一反应", "golden": true, "expected": { "scene_boundaries_us": null, "scene_tolerance_us": 250000, "stack_label": "D-interruption", "important_event": true, "recommend_or_retain": true, "unique_event": true, "narrative_critical": true } },
    { "id": "D-010", "source": { "kind": "seed", "relative_path": "D/D-010.mov", "generation_command": null }, "scenario": "路人打断口播", "golden": false, "expected": { "scene_boundaries_us": null, "scene_tolerance_us": 250000, "stack_label": "D-interruption", "important_event": true, "recommend_or_retain": true, "unique_event": true, "narrative_critical": true } },
    { "id": "D-011", "source": { "kind": "seed", "relative_path": "D/D-011.mov", "generation_command": null }, "scenario": "车辆噪声打断对话", "golden": false, "expected": { "scene_boundaries_us": null, "scene_tolerance_us": 250000, "stack_label": "D-interruption", "important_event": false, "recommend_or_retain": true, "unique_event": false, "narrative_critical": false } },
    { "id": "D-012", "source": { "kind": "seed", "relative_path": "D/D-012.mov", "generation_command": null }, "scenario": "说错后自然重来", "golden": false, "expected": { "scene_boundaries_us": null, "scene_tolerance_us": 250000, "stack_label": "D-interruption", "important_event": false, "recommend_or_retain": true, "unique_event": false, "narrative_critical": false } },
    { "id": "D-013", "source": { "kind": "seed", "relative_path": "D/D-013.mov", "generation_command": null }, "scenario": "看到野生动物的真实反应", "golden": false, "expected": { "scene_boundaries_us": null, "scene_tolerance_us": 250000, "stack_label": "D-reaction", "important_event": true, "recommend_or_retain": true, "unique_event": true, "narrative_critical": true } },
    { "id": "D-014", "source": { "kind": "seed", "relative_path": "D/D-014.mov", "generation_command": null }, "scenario": "抵达后的疲惫反应", "golden": false, "expected": { "scene_boundaries_us": null, "scene_tolerance_us": 250000, "stack_label": "D-reaction", "important_event": false, "recommend_or_retain": true, "unique_event": false, "narrative_critical": false } },
    { "id": "D-015", "source": { "kind": "seed", "relative_path": "D/D-015.mov", "generation_command": null }, "scenario": "意外成功后的庆祝", "golden": false, "expected": { "scene_boundaries_us": null, "scene_tolerance_us": 250000, "stack_label": "D-reaction", "important_event": true, "recommend_or_retain": true, "unique_event": true, "narrative_critical": true } },
    { "id": "D-016", "source": { "kind": "seed", "relative_path": "D/D-016.mov", "generation_command": null }, "scenario": "失败后的安静反应", "golden": false, "expected": { "scene_boundaries_us": null, "scene_tolerance_us": 250000, "stack_label": "D-reaction", "important_event": true, "recommend_or_retain": true, "unique_event": true, "narrative_critical": true } }
  ]
}

