{
  "schema_version": 1,
  "group": { "id": "B", "name": "公路与天气", "source_kind": "seed" },
  "defaults": {
    "expected": { "scene_boundaries_us": null, "scene_tolerance_us": 250000, "stack_label": null, "important_event": false, "recommend_or_retain": true, "unique_event": false, "narrative_critical": false },
    "timeline": { "vfr_checkpoints_us": [], "proxy_checkpoints_us": [] },
    "routine": null
  },
  "fixtures": [
    { "id": "B-001", "source": { "kind": "seed", "relative_path": "B/B-001.mov", "generation_command": null }, "scenario": "晴天公路前视", "golden": false, "expected": { "scene_boundaries_us": null, "scene_tolerance_us": 250000, "stack_label": "B-dry-road", "important_event": false, "recommend_or_retain": true, "unique_event": false, "narrative_critical": false } },
    { "id": "B-002", "source": { "kind": "seed", "relative_path": "B/B-002.mov", "generation_command": null }, "scenario": "晴天公路侧窗", "golden": false, "expected": { "scene_boundaries_us": null, "scene_tolerance_us": 250000, "stack_label": "B-dry-road", "important_event": false, "recommend_or_retain": true, "unique_event": false, "narrative_critical": false } },
    { "id": "B-003", "source": { "kind": "seed", "relative_path": "B/B-003.mov", "generation_command": null }, "scenario": "干燥盘山路", "golden": false, "expected": { "scene_boundaries_us": null, "scene_tolerance_us": 250000, "stack_label": "B-dry-road", "important_event": false, "recommend_or_retain": true, "unique_event": false, "narrative_critical": false } },
    { "id": "B-004", "source": { "kind": "seed", "relative_path": "B/B-004.mov", "generation_command": null }, "scenario": "公路延时替代", "golden": false, "expected": { "scene_boundaries_us": null, "scene_tolerance_us": 250000, "stack_label": "B-dry-road", "important_event": false, "recommend_or_retain": true, "unique_event": false, "narrative_critical": false } },
    { "id": "B-005", "source": { "kind": "seed", "relative_path": "B/B-005.mov", "generation_command": null }, "scenario": "雨天挡风玻璃", "golden": false, "expected": { "scene_boundaries_us": null, "scene_tolerance_us": 250000, "stack_label": "B-rain-road", "important_event": false, "recommend_or_retain": true, "unique_event": false, "narrative_critical": false } },
    { "id": "B-006", "source": { "kind": "seed", "relative_path": "B/B-006.mov", "generation_command": null }, "scenario": "暴雨雨刷", "golden": false, "expected": { "scene_boundaries_us": null, "scene_tolerance_us": 250000, "stack_label": "B-rain-road", "important_event": false, "recommend_or_retain": true, "unique_event": false, "narrative_critical": false } },
    { "id": "B-007", "source": { "kind": "seed", "relative_path": "B/B-007.mov", "generation_command": null }, "scenario": "雨中停车", "golden": false, "expected": { "scene_boundaries_us": null, "scene_tolerance_us": 250000, "stack_label": "B-rain-road", "important_event": false, "recommend_or_retain": true, "unique_event": false, "narrative_critical": false } },
    { "id": "B-008", "source": { "kind": "seed", "relative_path": "B/B-008.mov", "generation_command": null }, "scenario": "雨后路面积水", "golden": false, "expected": { "scene_boundaries_us": null, "scene_tolerance_us": 250000, "stack_label": "B-rain-road", "important_event": false, "recommend_or_retain": true, "unique_event": false, "narrative_critical": false } },
    { "id": "B-009", "source": { "kind": "seed", "relative_path": "B/B-009.mov", "generation_command": null }, "scenario": "首次雪路打滑险情", "golden": true, "expected": { "scene_boundaries_us": null, "scene_tolerance_us": 250000, "stack_label": "B-snow-road", "important_event": true, "recommend_or_retain": true, "unique_event": true, "narrative_critical": true } },
    { "id": "B-010", "source": { "kind": "seed", "relative_path": "B/B-010.mov", "generation_command": null }, "scenario": "稳定雪路前视", "golden": false, "expected": { "scene_boundaries_us": null, "scene_tolerance_us": 250000, "stack_label": "B-snow-road", "important_event": false, "recommend_or_retain": true, "unique_event": false, "narrative_critical": false } },
    { "id": "B-011", "source": { "kind": "seed", "relative_path": "B/B-011.mov", "generation_command": null }, "scenario": "降雪能见度变化", "golden": false, "expected": { "scene_boundaries_us": null, "scene_tolerance_us": 250000, "stack_label": "B-snow-road", "important_event": false, "recommend_or_retain": true, "unique_event": false, "narrative_critical": false } },
    { "id": "B-012", "source": { "kind": "seed", "relative_path": "B/B-012.mov", "generation_command": null }, "scenario": "雪地停车观察", "golden": false, "expected": { "scene_boundaries_us": null, "scene_tolerance_us": 250000, "stack_label": "B-snow-road", "important_event": false, "recommend_or_retain": true, "unique_event": false, "narrative_critical": false } },
    { "id": "B-013", "source": { "kind": "seed", "relative_path": "B/B-013.mov", "generation_command": null }, "scenario": "夜间公路", "golden": false, "expected": { "scene_boundaries_us": null, "scene_tolerance_us": 250000, "stack_label": "B-night-gravel", "important_event": false, "recommend_or_retain": true, "unique_event": false, "narrative_critical": false } },
    { "id": "B-014", "source": { "kind": "seed", "relative_path": "B/B-014.mov", "generation_command": null }, "scenario": "砾石路强震动", "golden": false, "expected": { "scene_boundaries_us": null, "scene_tolerance_us": 250000, "stack_label": "B-night-gravel", "important_event": false, "recommend_or_retain": true, "unique_event": false, "narrative_critical": false } },
    { "id": "B-015", "source": { "kind": "seed", "relative_path": "B/B-015.mov", "generation_command": null }, "scenario": "夜间会车曝光突变", "golden": false, "expected": { "scene_boundaries_us": null, "scene_tolerance_us": 250000, "stack_label": "B-night-gravel", "important_event": false, "recommend_or_retain": true, "unique_event": false, "narrative_critical": false } },
    { "id": "B-016", "source": { "kind": "seed", "relative_path": "B/B-016.mov", "generation_command": null }, "scenario": "砾石路停车收束", "golden": false, "expected": { "scene_boundaries_us": null, "scene_tolerance_us": 250000, "stack_label": "B-night-gravel", "important_event": false, "recommend_or_retain": true, "unique_event": false, "narrative_critical": false } }
  ]
}

