{
  "schema_version": 1,
  "group": {
    "id": "F",
    "name": "技术边角与时间完整性",
    "source_kind": "seed"
  },
  "defaults": {
    "expected": {
      "scene_boundaries_us": null,
      "scene_tolerance_us": 250000,
      "stack_label": null,
      "important_event": false,
      "recommend_or_retain": true,
      "unique_event": false,
      "narrative_critical": false
    },
    "timeline": {
      "vfr_checkpoints_us": [],
      "proxy_checkpoints_us": []
    },
    "routine": null
  },
  "fixtures": [
    {
      "id": "F-001",
      "source": {
        "kind": "seed",
        "relative_path": "F/F-001.mp4",
        "generation_command": null
      },
      "scenario": "H.264 24fps",
      "golden": false,
      "timeline": {
        "vfr_checkpoints_us": [],
        "proxy_checkpoints_us": [
          0,
          1000000,
          3000000
        ]
      }
    },
    {
      "id": "F-002",
      "source": {
        "kind": "seed",
        "relative_path": "F/F-002.mp4",
        "generation_command": null
      },
      "scenario": "H.264 30fps",
      "golden": false,
      "timeline": {
        "vfr_checkpoints_us": [],
        "proxy_checkpoints_us": [
          0,
          1000000,
          3000000
        ]
      }
    },
    {
      "id": "F-003",
      "source": {
        "kind": "seed",
        "relative_path": "F/F-003.mp4",
        "generation_command": null
      },
      "scenario": "H.264 60fps",
      "golden": false,
      "timeline": {
        "vfr_checkpoints_us": [],
        "proxy_checkpoints_us": [
          0,
          1000000,
          3000000
        ]
      }
    },
    {
      "id": "F-004",
      "source": {
        "kind": "seed",
        "relative_path": "F/F-004.mov",
        "generation_command": null
      },
      "scenario": "HEVC 8-bit 4:2:0",
      "golden": false,
      "timeline": {
        "vfr_checkpoints_us": [],
        "proxy_checkpoints_us": [
          0,
          1000000,
          3000000
        ]
      }
    },
    {
      "id": "F-005",
      "source": {
        "kind": "seed",
        "relative_path": "F/F-005.mov",
        "generation_command": null
      },
      "scenario": "HEVC 10-bit 4:2:0",
      "golden": false,
      "timeline": {
        "vfr_checkpoints_us": [],
        "proxy_checkpoints_us": [
          0,
          1000000,
          3000000
        ]
      }
    },
    {
      "id": "F-006",
      "source": {
        "kind": "seed",
        "relative_path": "F/F-006.mov",
        "generation_command": null
      },
      "scenario": "手机 VFR",
      "golden": false,
      "timeline": {
        "vfr_checkpoints_us": [
          0,
          33367,
          100100,
          500500,
          1001000,
          3003000
        ],
        "proxy_checkpoints_us": [
          0,
          100100,
          500500,
          1001000,
          3003000
        ]
      }
    },
    {
      "id": "F-007",
      "source": {
        "kind": "seed",
        "relative_path": "F/F-007.mov",
        "generation_command": null
      },
      "scenario": "HDR HLG 10-bit",
      "golden": false,
      "timeline": {
        "vfr_checkpoints_us": [],
        "proxy_checkpoints_us": [
          0,
          1000000,
          3000000
        ]
      }
    },
    {
      "id": "F-008",
      "source": {
        "kind": "seed",
        "relative_path": "F/F-008.mov",
        "generation_command": null
      },
      "scenario": "竖屏 9:16",
      "golden": false,
      "timeline": {
        "vfr_checkpoints_us": [],
        "proxy_checkpoints_us": [
          0,
          1000000,
          3000000
        ]
      }
    },
    {
      "id": "F-009",
      "source": {
        "kind": "seed",
        "relative_path": "F/F-009.mov",
        "generation_command": null
      },
      "scenario": "旋转元数据 90 度",
      "golden": false,
      "timeline": {
        "vfr_checkpoints_us": [],
        "proxy_checkpoints_us": [
          0,
          1000000,
          3000000
        ]
      }
    },
    {
      "id": "F-010",
      "source": {
        "kind": "seed",
        "relative_path": "F/F-010.mov",
        "generation_command": null
      },
      "scenario": "损坏尾帧，必须标记且不崩溃",
      "golden": false,
      "expected": {
        "scene_boundaries_us": null,
        "scene_tolerance_us": 250000,
        "stack_label": null,
        "important_event": false,
        "recommend_or_retain": true,
        "unique_event": false,
        "narrative_critical": false
      }
    },
    {
      "id": "F-011",
      "source": {
        "kind": "seed",
        "relative_path": "F/F-011.mov",
        "generation_command": null
      },
      "scenario": "损坏尾帧(第二条),必须标记且不崩溃",
      "golden": false,
      "timeline": {
        "vfr_checkpoints_us": [],
        "proxy_checkpoints_us": [
          0,
          1000000,
          5000000
        ]
      },
      "expected": {
        "scene_boundaries_us": null,
        "scene_tolerance_us": 250000,
        "stack_label": null,
        "important_event": false,
        "recommend_or_retain": true,
        "unique_event": false,
        "narrative_critical": false
      }
    },
    {
      "id": "F-012",
      "source": {
        "kind": "seed",
        "relative_path": "F/F-012.mov",
        "generation_command": null
      },
      "scenario": "长录制文件",
      "golden": false,
      "timeline": {
        "vfr_checkpoints_us": [],
        "proxy_checkpoints_us": [
          0,
          60000000,
          300000000
        ]
      }
    },
    {
      "id": "F-013",
      "source": {
        "kind": "seed",
        "relative_path": "F/F-013.mov",
        "generation_command": null
      },
      "scenario": "容器时区错误",
      "golden": false
    },
    {
      "id": "F-014",
      "source": {
        "kind": "seed",
        "relative_path": "F/F-014.mov",
        "generation_command": null
      },
      "scenario": "设备钟错误但内容为唯一边检事件",
      "golden": true,
      "expected": {
        "scene_boundaries_us": null,
        "scene_tolerance_us": 250000,
        "stack_label": "F-clock-critical",
        "important_event": true,
        "recommend_or_retain": true,
        "unique_event": true,
        "narrative_critical": true
      }
    },
    {
      "id": "F-015",
      "source": {
        "kind": "seed",
        "relative_path": "F/F-015.mov",
        "generation_command": null
      },
      "scenario": "多音轨与四声道",
      "golden": false,
      "timeline": {
        "vfr_checkpoints_us": [],
        "proxy_checkpoints_us": [
          0,
          1000000,
          3000000
        ]
      }
    },
    {
      "id": "F-016",
      "source": {
        "kind": "seed",
        "relative_path": "F/F-016.mov",
        "generation_command": null
      },
      "scenario": "ProRes 422",
      "golden": false,
      "timeline": {
        "vfr_checkpoints_us": [],
        "proxy_checkpoints_us": [
          0,
          1000000,
          3000000
        ]
      }
    },
    {
      "id": "F-017",
      "source": {
        "kind": "seed",
        "relative_path": "F/F-017.mov",
        "generation_command": null
      },
      "scenario": "音频逐步漂移",
      "golden": false,
      "timeline": {
        "vfr_checkpoints_us": [],
        "proxy_checkpoints_us": [
          0,
          1000000,
          5000000,
          10000000
        ]
      }
    }
  ]
}