{
  "schema_version": 1,
  "group": { "id": "C", "name": "房车生活与 Routine", "source_kind": "seed" },
  "defaults": {
    "expected": { "scene_boundaries_us": null, "scene_tolerance_us": 250000, "stack_label": null, "important_event": false, "recommend_or_retain": true, "unique_event": false, "narrative_critical": false },
    "timeline": { "vfr_checkpoints_us": [], "proxy_checkpoints_us": [] },
    "routine": null
  },
  "fixtures": [
    { "id": "C-001", "source": { "kind": "seed", "relative_path": "C/C-001.mov", "generation_command": null }, "scenario": "第一次冲咖啡完整说明", "golden": false, "expected": { "scene_boundaries_us": null, "scene_tolerance_us": 250000, "stack_label": "C-coffee", "important_event": false, "recommend_or_retain": true, "unique_event": false, "narrative_critical": false }, "routine": { "kind": "咖啡", "occurrence_index": 1 } },
    { "id": "C-002", "source": { "kind": "seed", "relative_path": "C/C-002.mov", "generation_command": null }, "scenario": "第二次冲咖啡", "golden": false, "expected": { "scene_boundaries_us": null, "scene_tolerance_us": 250000, "stack_label": "C-coffee", "important_event": false, "recommend_or_retain": true, "unique_event": false, "narrative_critical": false }, "routine": { "kind": "咖啡", "occurrence_index": 2 } },
    { "id": "C-003", "source": { "kind": "seed", "relative_path": "C/C-003.mov", "generation_command": null }, "scenario": "第三次冲咖啡", "golden": false, "expected": { "scene_boundaries_us": null, "scene_tolerance_us": 250000, "stack_label": "C-coffee", "important_event": false, "recommend_or_retain": true, "unique_event": false, "narrative_critical": false }, "routine": { "kind": "咖啡", "occurrence_index": 3 } },
    { "id": "C-004", "source": { "kind": "seed", "relative_path": "C/C-004.mov", "generation_command": null }, "scenario": "第四次冲咖啡新地点", "golden": false, "expected": { "scene_boundaries_us": null, "scene_tolerance_us": 250000, "stack_label": "C-coffee", "important_event": false, "recommend_or_retain": true, "unique_event": false, "narrative_critical": false }, "routine": { "kind": "咖啡", "occurrence_index": 4 } },
    { "id": "C-005", "source": { "kind": "seed", "relative_path": "C/C-005.mov", "generation_command": null }, "scenario": "第一次接水说明", "golden": false, "expected": { "scene_boundaries_us": null, "scene_tolerance_us": 250000, "stack_label": "C-water", "important_event": false, "recommend_or_retain": true, "unique_event": false, "narrative_critical": false }, "routine": { "kind": "接水", "occurrence_index": 1 } },
    { "id": "C-006", "source": { "kind": "seed", "relative_path": "C/C-006.mov", "generation_command": null }, "scenario": "第二次接水", "golden": false, "expected": { "scene_boundaries_us": null, "scene_tolerance_us": 250000, "stack_label": "C-water", "important_event": false, "recommend_or_retain": true, "unique_event": false, "narrative_critical": false }, "routine": { "kind": "接水", "occurrence_index": 2 } },
    { "id": "C-007", "source": { "kind": "seed", "relative_path": "C/C-007.mov", "generation_command": null }, "scenario": "第三次接水", "golden": false, "expected": { "scene_boundaries_us": null, "scene_tolerance_us": 250000, "stack_label": "C-water", "important_event": false, "recommend_or_retain": true, "unique_event": false, "narrative_critical": false }, "routine": { "kind": "接水", "occurrence_index": 3 } },
    { "id": "C-008", "source": { "kind": "seed", "relative_path": "C/C-008.mov", "generation_command": null }, "scenario": "第四次接水不同天气", "golden": false, "expected": { "scene_boundaries_us": null, "scene_tolerance_us": 250000, "stack_label": "C-water", "important_event": false, "recommend_or_retain": true, "unique_event": false, "narrative_critical": false }, "routine": { "kind": "接水", "occurrence_index": 4 } },
    { "id": "C-009", "source": { "kind": "seed", "relative_path": "C/C-009.mov", "generation_command": null }, "scenario": "第一次做饭说明", "golden": false, "expected": { "scene_boundaries_us": null, "scene_tolerance_us": 250000, "stack_label": "C-cooking", "important_event": false, "recommend_or_retain": true, "unique_event": false, "narrative_critical": false }, "routine": { "kind": "做饭", "occurrence_index": 1 } },
    { "id": "C-010", "source": { "kind": "seed", "relative_path": "C/C-010.mov", "generation_command": null }, "scenario": "第二次做饭", "golden": false, "expected": { "scene_boundaries_us": null, "scene_tolerance_us": 250000, "stack_label": "C-cooking", "important_event": false, "recommend_or_retain": true, "unique_event": false, "narrative_critical": false }, "routine": { "kind": "做饭", "occurrence_index": 2 } },
    { "id": "C-011", "source": { "kind": "seed", "relative_path": "C/C-011.mov", "generation_command": null }, "scenario": "第三次做饭", "golden": false, "expected": { "scene_boundaries_us": null, "scene_tolerance_us": 250000, "stack_label": "C-cooking", "important_event": false, "recommend_or_retain": true, "unique_event": false, "narrative_critical": false }, "routine": { "kind": "做饭", "occurrence_index": 3 } },
    { "id": "C-012", "source": { "kind": "seed", "relative_path": "C/C-012.mov", "generation_command": null }, "scenario": "第四次做饭新菜式", "golden": false, "expected": { "scene_boundaries_us": null, "scene_tolerance_us": 250000, "stack_label": "C-cooking", "important_event": false, "recommend_or_retain": true, "unique_event": false, "narrative_critical": false }, "routine": { "kind": "做饭", "occurrence_index": 4 } },
    { "id": "C-013", "source": { "kind": "seed", "relative_path": "C/C-013.mov", "generation_command": null }, "scenario": "接水时水管爆裂，Routine 升级为故事事件", "golden": true, "expected": { "scene_boundaries_us": null, "scene_tolerance_us": 250000, "stack_label": "C-water-failure", "important_event": true, "recommend_or_retain": true, "unique_event": true, "narrative_critical": true }, "routine": { "kind": "接水", "occurrence_index": 5 } },
    { "id": "C-014", "source": { "kind": "seed", "relative_path": "C/C-014.mov", "generation_command": null }, "scenario": "调平失败后的处理", "golden": false, "expected": { "scene_boundaries_us": null, "scene_tolerance_us": 250000, "stack_label": "C-leveling-failure", "important_event": true, "recommend_or_retain": true, "unique_event": true, "narrative_critical": true }, "routine": { "kind": "调平", "occurrence_index": 2 } },
    { "id": "C-015", "source": { "kind": "seed", "relative_path": "C/C-015.mov", "generation_command": null }, "scenario": "做饭时燃气告警", "golden": false, "expected": { "scene_boundaries_us": null, "scene_tolerance_us": 250000, "stack_label": "C-cooking-failure", "important_event": true, "recommend_or_retain": true, "unique_event": true, "narrative_critical": true }, "routine": { "kind": "做饭", "occurrence_index": 5 } },
    { "id": "C-016", "source": { "kind": "seed", "relative_path": "C/C-016.mov", "generation_command": null }, "scenario": "收营时遗失关键部件", "golden": false, "expected": { "scene_boundaries_us": null, "scene_tolerance_us": 250000, "stack_label": "C-packdown-failure", "important_event": true, "recommend_or_retain": true, "unique_event": true, "narrative_critical": true }, "routine": { "kind": "收营", "occurrence_index": 3 } }
  ]
}
